{
  "schemaVersion": "cockroach.browser-automation-capability-matrix.v1",
  "packageVersion": "0.8.0-rc.1",
  "scope": "product-owned-governed-browser-automation",
  "summary": {
    "catalogedActions": 102,
    "catalogedCategories": 16,
    "builtInHandlerActions": 60,
    "trustedServiceRequiredActions": 11,
    "explicitlyUnsupportedActions": 31,
    "realEngineIntegrationVerifiedActions": 28
  },
  "interpretation": {
    "cataloged": "The normalized contract and validator exist; this alone is not runtime support.",
    "builtInHandler": "The shipped engine adapter has a handler, subject to runtime method probes and authority checks.",
    "trustedServiceRequired": "The handler is available only when the host injects every named trusted service.",
    "realEngineIntegrationVerified": "The repository's installed-engine smoke test executes this action kind.",
    "separateProductContract": "Cockroach Browser is a separate product; this repository does not self-attest its feature coverage."
  },
  "categories": [
    {
      "id": "lifecycle-connect",
      "status": "unsupported",
      "catalogedActions": 4,
      "maximumBackendActions": 0,
      "realEngineIntegrationVerifiedActions": 0
    },
    {
      "id": "sessions-pages-tabs",
      "status": "partial",
      "catalogedActions": 11,
      "maximumBackendActions": 7,
      "realEngineIntegrationVerifiedActions": 4
    },
    {
      "id": "navigation-waits",
      "status": "maximum-backend-covered",
      "catalogedActions": 8,
      "maximumBackendActions": 8,
      "realEngineIntegrationVerifiedActions": 3
    },
    {
      "id": "locators-elements-forms",
      "status": "maximum-backend-covered",
      "catalogedActions": 11,
      "maximumBackendActions": 11,
      "realEngineIntegrationVerifiedActions": 7
    },
    {
      "id": "keyboard-input",
      "status": "maximum-backend-covered",
      "catalogedActions": 4,
      "maximumBackendActions": 4,
      "realEngineIntegrationVerifiedActions": 1
    },
    {
      "id": "pointer-touch-drag",
      "status": "maximum-backend-covered",
      "catalogedActions": 7,
      "maximumBackendActions": 7,
      "realEngineIntegrationVerifiedActions": 2
    },
    {
      "id": "files-dialogs",
      "status": "partial",
      "catalogedActions": 5,
      "maximumBackendActions": 1,
      "realEngineIntegrationVerifiedActions": 1
    },
    {
      "id": "screenshots-pdf",
      "status": "maximum-backend-covered",
      "catalogedActions": 3,
      "maximumBackendActions": 3,
      "realEngineIntegrationVerifiedActions": 1
    },
    {
      "id": "evaluation-scripts-workers",
      "status": "partial",
      "catalogedActions": 5,
      "maximumBackendActions": 4,
      "realEngineIntegrationVerifiedActions": 0
    },
    {
      "id": "network",
      "status": "partial",
      "catalogedActions": 10,
      "maximumBackendActions": 5,
      "realEngineIntegrationVerifiedActions": 2
    },
    {
      "id": "cookies-storage",
      "status": "partial",
      "catalogedActions": 11,
      "maximumBackendActions": 10,
      "realEngineIntegrationVerifiedActions": 4
    },
    {
      "id": "permissions-geolocation-emulation",
      "status": "partial",
      "catalogedActions": 3,
      "maximumBackendActions": 2,
      "realEngineIntegrationVerifiedActions": 0
    },
    {
      "id": "accessibility-page-tools",
      "status": "partial",
      "catalogedActions": 5,
      "maximumBackendActions": 4,
      "realEngineIntegrationVerifiedActions": 0
    },
    {
      "id": "tracing-metrics-recording",
      "status": "partial",
      "catalogedActions": 5,
      "maximumBackendActions": 1,
      "realEngineIntegrationVerifiedActions": 0
    },
    {
      "id": "coverage-console-heap",
      "status": "partial",
      "catalogedActions": 4,
      "maximumBackendActions": 1,
      "realEngineIntegrationVerifiedActions": 0
    },
    {
      "id": "selectors-page-tools",
      "status": "partial",
      "catalogedActions": 6,
      "maximumBackendActions": 3,
      "realEngineIntegrationVerifiedActions": 3
    }
  ],
  "actions": [
    {
      "kind": "browser.connect",
      "category": "lifecycle-connect",
      "effect": "write",
      "defaultEnabled": false,
      "contract": "cataloged",
      "crawlerCore": "not-directly-exposed",
      "cockroachBrowser": "separate-product-contract",
      "governedAdapter": "unsupported",
      "requiredServices": [],
      "realEngineIntegrationVerified": false
    },
    {
      "kind": "browser.disconnect",
      "category": "lifecycle-connect",
      "effect": "write",
      "defaultEnabled": false,
      "contract": "cataloged",
      "crawlerCore": "not-directly-exposed",
      "cockroachBrowser": "separate-product-contract",
      "governedAdapter": "unsupported",
      "requiredServices": [],
      "realEngineIntegrationVerified": false
    },
    {
      "kind": "context.create",
      "category": "lifecycle-connect",
      "effect": "write",
      "defaultEnabled": false,
      "contract": "cataloged",
      "crawlerCore": "not-directly-exposed",
      "cockroachBrowser": "separate-product-contract",
      "governedAdapter": "unsupported",
      "requiredServices": [],
      "realEngineIntegrationVerified": false
    },
    {
      "kind": "context.close",
      "category": "lifecycle-connect",
      "effect": "write",
      "defaultEnabled": false,
      "contract": "cataloged",
      "crawlerCore": "not-directly-exposed",
      "cockroachBrowser": "separate-product-contract",
      "governedAdapter": "unsupported",
      "requiredServices": [],
      "realEngineIntegrationVerified": false
    },
    {
      "kind": "session.inspect",
      "category": "sessions-pages-tabs",
      "effect": "read",
      "defaultEnabled": true,
      "contract": "cataloged",
      "crawlerCore": "not-directly-exposed",
      "cockroachBrowser": "separate-product-contract",
      "governedAdapter": "built-in-handler",
      "requiredServices": [],
      "realEngineIntegrationVerified": false
    },
    {
      "kind": "page.list",
      "category": "sessions-pages-tabs",
      "effect": "read",
      "defaultEnabled": true,
      "contract": "cataloged",
      "crawlerCore": "not-directly-exposed",
      "cockroachBrowser": "separate-product-contract",
      "governedAdapter": "built-in-handler",
      "requiredServices": [],
      "realEngineIntegrationVerified": false
    },
    {
      "kind": "tab.open",
      "category": "sessions-pages-tabs",
      "effect": "write",
      "defaultEnabled": false,
      "contract": "cataloged",
      "crawlerCore": "not-directly-exposed",
      "cockroachBrowser": "separate-product-contract",
      "governedAdapter": "built-in-handler",
      "requiredServices": [],
      "realEngineIntegrationVerified": true
    },
    {
      "kind": "tab.close",
      "category": "sessions-pages-tabs",
      "effect": "write",
      "defaultEnabled": false,
      "contract": "cataloged",
      "crawlerCore": "not-directly-exposed",
      "cockroachBrowser": "separate-product-contract",
      "governedAdapter": "built-in-handler",
      "requiredServices": [],
      "realEngineIntegrationVerified": true
    },
    {
      "kind": "tab.switch",
      "category": "sessions-pages-tabs",
      "effect": "write",
      "defaultEnabled": false,
      "contract": "cataloged",
      "crawlerCore": "not-directly-exposed",
      "cockroachBrowser": "separate-product-contract",
      "governedAdapter": "built-in-handler",
      "requiredServices": [],
      "realEngineIntegrationVerified": false
    },
    {
      "kind": "tab.lock",
      "category": "sessions-pages-tabs",
      "effect": "write",
      "defaultEnabled": false,
      "contract": "cataloged",
      "crawlerCore": "not-directly-exposed",
      "cockroachBrowser": "separate-product-contract",
      "governedAdapter": "unsupported",
      "requiredServices": [],
      "realEngineIntegrationVerified": false
    },
    {
      "kind": "tab.unlock",
      "category": "sessions-pages-tabs",
      "effect": "write",
      "defaultEnabled": false,
      "contract": "cataloged",
      "crawlerCore": "not-directly-exposed",
      "cockroachBrowser": "separate-product-contract",
      "governedAdapter": "unsupported",
      "requiredServices": [],
      "realEngineIntegrationVerified": false
    },
    {
      "kind": "tab.lock.status",
      "category": "sessions-pages-tabs",
      "effect": "read",
      "defaultEnabled": false,
      "contract": "cataloged",
      "crawlerCore": "not-directly-exposed",
      "cockroachBrowser": "separate-product-contract",
      "governedAdapter": "unsupported",
      "requiredServices": [],
      "realEngineIntegrationVerified": false
    },
    {
      "kind": "popup.wait",
      "category": "sessions-pages-tabs",
      "effect": "read",
      "defaultEnabled": false,
      "contract": "cataloged",
      "crawlerCore": "not-directly-exposed",
      "cockroachBrowser": "separate-product-contract",
      "governedAdapter": "unsupported",
      "requiredServices": [],
      "realEngineIntegrationVerified": false
    },
    {
      "kind": "frame.list",
      "category": "sessions-pages-tabs",
      "effect": "read",
      "defaultEnabled": true,
      "contract": "cataloged",
      "crawlerCore": "not-directly-exposed",
      "cockroachBrowser": "separate-product-contract",
      "governedAdapter": "built-in-handler",
      "requiredServices": [],
      "realEngineIntegrationVerified": true
    },
    {
      "kind": "frame.select",
      "category": "sessions-pages-tabs",
      "effect": "write",
      "defaultEnabled": false,
      "contract": "cataloged",
      "crawlerCore": "not-directly-exposed",
      "cockroachBrowser": "separate-product-contract",
      "governedAdapter": "built-in-handler",
      "requiredServices": [],
      "realEngineIntegrationVerified": true
    },
    {
      "kind": "navigate",
      "category": "navigation-waits",